<?xml version="1.0" encoding="UTF-8"?>
<base xmlns:xsi="http://www.w3.org/2001/XMLSchema-instance" xsi:noNamespaceSchemaLocation="base.xsd">
	<search>
		<search-properties>
			<property qualifier="Media.code"/>
			<property qualifier="Media.altText"/>
			<property qualifier="Media.description"/>
		</search-properties>
		<sort-properties>
			<property qualifier="Item.modifiedtime"/>
			<property qualifier="Item.pk"/>
			<property qualifier="Media.code"/>
			<property qualifier="Media.altText"/>
			<property qualifier="Media.description"/>
		</sort-properties>
	</search>
	<label spring-bean="mediaLabelProvider"/>
	<initial-properties source-object-template="CMSItem">
		<property-mapping source="src.catalogVersion" target="Media.catalogVersion"/>
	</initial-properties>
	<initial-properties source-object-template="Product">
		<property-mapping source="src.catalogVersion" target="Media.catalogVersion"/>
	</initial-properties>
</base>