<?xml version="1.0" encoding="UTF-8"?>
<base xmlns:xsi="http://www.w3.org/2001/XMLSchema-instance" xsi:noNamespaceSchemaLocation="base.xsd">
	<search>
		<search-properties>
			<property qualifier="Language.isocode"/>
			<property qualifier="Language.name"/>
		</search-properties>
		<sort-properties>
			<property qualifier="Item.modifiedtime"/>
			<property qualifier="Language.isocode"/>
			<property qualifier="Language.name"/>
		</sort-properties>
	</search>
	<label spring-bean="languageLabelProvider"/>
</base>