<?xml version="1.0" encoding="UTF-8"?>
<base xmlns:xsi="http://www.w3.org/2001/XMLSchema-instance" xsi:noNamespaceSchemaLocation="base.xsd">
	<search>
		<search-properties>
			<property qualifier="WorkflowAction.code"/>
			<property qualifier="WorkflowAction.name"/>
		</search-properties>
		<sort-properties>
			<property qualifier="Item.modifiedtime"/>
			<property qualifier="WorkflowAction.code"/>
			<property qualifier="WorkflowAction.name"/>
		</sort-properties>
	</search>
	<label>
		<property qualifier="WorkflowAction.name"/>
	</label>
</base>