<?xml version="1.0" encoding="UTF-8"?>
<base xmlns:xsi="http://www.w3.org/2001/XMLSchema-instance" xsi:noNamespaceSchemaLocation="base.xsd">
	<search>
		<search-properties>
			<property qualifier="Product.code"/>
			<property qualifier="Product.name"/>
			<property qualifier="Product.description"/>
			<property qualifier="Product.summary"/>
		</search-properties>
		<sort-properties>
			<property qualifier="Item.modifiedtime"/>
			<property qualifier="Product.code"/>
			<property qualifier="Product.name"/>
			<property qualifier="Product.description"/>
			<property qualifier="Item.pk"/>
		</sort-properties>
	</search>
	<label spring-bean="productLabelProvider"/>
</base>