<?xml version="1.0" encoding="UTF-8"?>
<base xmlns:xsi="http://www.w3.org/2001/XMLSchema-instance" xsi:noNamespaceSchemaLocation="base.xsd">
	<search>
		<search-properties>
			<property qualifier="MediaContainer.qualifier"/>
			<property qualifier="MediaContainer.catalogVersion"/>
			<property qualifier="MediaContainer.name"/>
		</search-properties>
		<sort-properties>
			<property qualifier="MediaContainer.qualifier"/>
			<property qualifier="MediaContainer.catalogVersion"/>
			<property qualifier="MediaContainer.name"/>
		</sort-properties>
	</search>
	<label>
		<property qualifier="MediaContainer.qualifier"/>
	</label>
	<initial-properties source-object-template="Product">
		<property-mapping source="src.catalogVersion" target="MediaContainer.catalogVersion"/>
	</initial-properties>
</base>